{
  "issuer": "https://gateway.example.com",
  "ai_routing_discovery_version": "0.1",
  "chat_completion_endpoint": "https://gateway.example.com/v1/chat/completions",
  "completion_endpoint": "https://gateway.example.com/v1/completions",
  "embeddings_endpoint": "https://gateway.example.com/v1/embeddings",
  "responses_endpoint": "https://gateway.example.com/v1/responses",
  "images_endpoint": "https://gateway.example.com/v1/images/generations",
  "audio_endpoint": "https://gateway.example.com/v1/audio/speech",
  "moderations_endpoint": "https://gateway.example.com/v1/moderations",
  "files_endpoint": "https://gateway.example.com/v1/files",
  "batch_endpoint": "https://gateway.example.com/v1/batches",
  "fine_tuning_endpoint": "https://gateway.example.com/v1/fine_tuning/jobs",
  "models_endpoint": "https://gateway.example.com/v1/models",
  "mcp_servers_endpoint": "https://gateway.example.com/v1/mcp_servers",
  "auth_methods_supported": ["api_key", "oauth2"],
  "token_endpoint": "https://gateway.example.com/oauth/token",
  "authorization_endpoint": "https://gateway.example.com/oauth/authorize",
  "scopes_supported": ["chat.completions", "embeddings.read", "mcp.filesystem"],
  "api_key_header": "Authorization",
  "api_key_scheme": "Bearer",
  "streaming_protocols_supported": ["sse"],
  "tool_calling_formats_supported": ["openai-tools", "mcp"],
  "rate_limits": "https://gateway.example.com/v1/rate_limits",
  "health_endpoint": "https://gateway.example.com/health",
  "status_page": "https://status.example.com",
  "pricing_endpoint": "https://gateway.example.com/v1/pricing",
  "documentation_url": "https://docs.example.com",
  "terms_of_service_url": "https://example.com/legal/tos",
  "privacy_policy_url": "https://example.com/legal/privacy",
  "jwks_uri": "https://gateway.example.com/.well-known/jwks.json",
  "contact": ["mailto:api-support@example.com"]
}
